type_of_reference,authors,primary_title,title,publication_year,year,abstract
JOUR,"LEE, Alwyn Vwen Yen",Supporting students’ generation of feedback in large-scale online course with artificial intelligence-enabled evaluation,,,2023,"Educators in large-scale online courses tend to lack the necessary resources to generate and provide adequate feedback for all students, especially when students’ learning outcomes are evaluated through student writing. As a result, students welcome peer feedback and sometimes generate self-feedback to widen their perspectives and obtain feedback, but often lack the support to do so. This study, as part of a larger project, sought to address this prevalent problem in large-scale courses by allowing students to write essays as an expression of their opinions and response to others, conduct peer and self-evaluation, using provided rubric and Artificial Intelligence (AI)-enabled evaluation to aid the giving and receiving of feedback. A total of 605 undergraduate students were part of a large-scale online course and contributed over 2500 short essays during a semester. The research design uses a mixed-methods approach, consisting qualitative measures used during essay coding, and quantitative methods from the application of machine learning algorithms. With limited instructors and resources, students first use instructor-developed rubric to conduct peer and self-assessment, while instructors qualitatively code a subset of essays that are used as inputs for training a machine learning model, which is subsequently used to provide automated scores and an accuracy rate for the remaining essays. With AI-enabled evaluation, the provision of feedback can become a sustainable process with students receiving and using meaningful feedback for their work, entailing shared responsibility from teachers and students, and becoming more effective."
JOUR,"Abo-Elghit, Amira Hamed, Hamza, Taher, Al-Zoghby, Aya",Embedding Extraction for Arabic Text Using the AraBERT Model,,,2022,"Nowadays, we can use the multi-task learning approach to train a machine-learning algorithm to learn multiple related tasks instead of training it to solve a single task. In this work, we propose an algorithm for estimating textual similarity scores and then use these scores in multiple tasks such as text ranking, essay grading, and question answering systems. We used several vectorization schemes to represent the Arabic texts in the SemEval2017-task3-subtask-D dataset. The used schemes include lexical-based similarity features, frequency-based features, and pre-trained model-based features. Also, we used contextual-based embedding models such as Arabic Bidirectional Encoder Representations from Transformers (AraBERT). We used the AraBERT model in two different variants. First, as a feature extractor in addition to the text vectorization schemes’ features. We fed those features to various regression models to make a prediction value that represents the relevancy score between Arabic text units. Second, AraBERT is adopted as a pre-trained model, and its parameters are fine-tuned to estimate the relevancy scores between Arabic textual sentences. To evaluate the research results, we conducted several experiments to compare the use of the AraBERT model in its two variants. In terms of Mean Absolute Percentage Error (MAPE), the results show minor variance between AraBERT v0.2 as a feature extractor (21.7723) and the fine-tuned AraBERT v2 (21.8211). On the other hand, AraBERT v0.2-Large as a feature extractor outperforms the fine-tuned AraBERT v2 model on the used data set in terms of the coefficient of determination (R2) values (0.014050,−0.032861), respectively."
JOUR,"Lyashevskaya, Olga, Panteleeva, Irina, Vinogradova, Olga",Automated assessment of learner text complexity,,,2021,"EFL methodology has always recognized the importance of giving student learners of foreign languages regular and quick feedback on student production, both written and oral. The presented paper describes the decisions taken during the development of an application to measure text complexity, and shows how the results achieved with this application were translated into feedback related to the author’s language proficiency. Along with some standard text complexity features, this tool takes into account those that are significant for Russian learners of English. The application provides students with the statistics of the relevant linguistic features of the text in comparison with texts of the learner essays that were considered the top and the bottom levels in the learner corpus. The paper also points out what text features are especially relevant for the assessment of the essays written in English by Russian students. The choice was made possible after the analysis of 3440 texts from Russian Error-Annotated English Learner Corpus, and after applying methods of machine learning and statistical analysis to predict the grade that could be received for the essay."
JOUR,"Sugiyama, Kohei, Yamanaka, Tsukasa",Proposals and Methods for Foreign Language Learning Using Machine Translation and Large Language Model,,,2023,"In this paper, we propose a new learning model that utilizes machine translation and large language models. While English education has traditionally been conducted through the relationship between English teachers and learners, replacing English teachers with machine translation and large language models may offer the potential to provide an equally or even more efficient and high-quality learning environment. The authors have developed a browser-based service to experience this educational environment for Japanese. To experience a new learning model that is high quality and efficient, we have implemented DeepL, a machine translation service that can translate with high accuracy, and ChatGPT, which uses a large language model that can generate natural sentences and adapt to a variety of tasks interactively. By combining these advanced services, it is now possible to provide explanations of the English translations and to evaluate the essays. This newly developed service is currently being experimentally used in English classes at a Japanese university. Interviews with users who used it revealed that they were easily exposed to English above their level. In other words, the results suggest that this proposed model can provide a better environment for English utilization than teachers. The developed service is available to anyone at the following URL. Transable: https://transable.net"
JOUR,"Süzen, Neslihan, Gorban, Alexander N., Levesley, Jeremy, Mirkes, Evgeny M.",Automatic short answer grading and feedback using text mining methods,,,2020,"Automatic grading is not a new approach but the need to adapt the latest technology to automatic grading has become very important. As the technology has rapidly became more powerful on scoring exams and essays, especially from the 1990s onwards, partially or wholly automated grading systems using computational methods have evolved and have become a major area of research. In particular, the demand of scoring of natural language responses has created a need for tools that can be applied to automatically grade these responses. In this paper, we focus on the concept of automatic grading of short answer questions such as are typical in the UK GCSE system, and providing useful feedback on their answers to students. We present experimental results on a dataset provided from the introductory computer science class in the University of North Texas. We first apply standard data mining techniques to the corpus of student answers for the purpose of measuring similarity between the student answers and the model answer. This is based on the number of common words. We then evaluate the relation between these similarities and marks awarded by scorers. We consider an approach that groups student answers into clusters. Each cluster would be awarded the same mark, and the same feedback given to each answer in a cluster. In this manner, we demonstrate that clusters indicate the groups of students who are awarded the same or the similar scores. Words in each cluster are compared to show that clusters are constructed based on how many and which words of the model answer have been used. The main novelty in this paper is that we design a model to predict marks based on the similarities between the student answers and the model answer. We argue that computational methods be used to enhance the reliability of human scoring, and not replace it. Humans are required to calibrate the system, and to deal with situations that are challenging. Computational methods can provide insight into which student answers will be found challenging and thus be a place human judgement is required."
JOUR,"Filho, Aluizio Haendchen, do Prado, Hércules A., Ferneda, Edilson, Nau, Jonathan",An approach to evaluate adherence to the theme and the argumentative structure of essays,,,2018,"This paper presents an approach based on machine learning for automatic grading of essay adherence to the theme and the argumentative structure of essays. The work was done according to the evaluation model adopted in Brazil to verify the mastery of skills and abilities of students who have completed high school. From specific adherence to the theme and the argumentative structure of essays features and others that are able to capture general aspects of the text, we trained and measured the efficiency of a classification and regression models based on support vector machines. The accuracy level found with this approach shows its effectiveness, pointing out the strategy as promising since other improvements can be achieved, such as improve the set of features with more effective essay-argumentative analysis techniques. Furthermore, we demonstrate how normalization and class balancing techniques are essential to improve our results using the small dataset available for this task. This work also introduces a set of textual cohesion features adapted to Portuguese that showed to be promising for evaluating adherence to the theme and the argumentative structure of essays."
JOUR,"de Carvalho Botega, Luiz Fernando, da Silva, Jonny Carlos",A data-driven Machine Learning approach to creativity and innovation techniques selection in solution development,,,2022,"The creation and refinement of new ideas is a strategic competence for teams and organization to innovate and prosper. This paper addresses the challenge of finding adequate creativity and innovation techniques (CITs) for improving individual or team creativity through the use of Machine Learning (ML). The process of choosing which CIT to use is complex and demanding, especially when taking into consideration the existence of hundreds of techniques and the plurality of different design contexts. This empiric knowledge, usually retained in an expert’s repertoire, can be extracted and implemented in a computational system, making it more available and permanent. This research focused on developing a Decision Support System embedded in an online application with a two-stage ML inference process able to evaluate users’ design scenario through an online form, and infer the most appropriate CITs from the database that would fit their needs. This paper presents two iterative development cycles of the prototype, first focused on core knowledge acquisition, representation, ML implementation, and verification; while second focused on system expansion, addition of web interface, and initial validation. After essaying 12 algorithms, the two-stage model achieved uses a Gradient Boosted Regression Trees algorithm using user provided information about the context to infer the required CITs characteristics; followed by a Logistic Regression classification-ranking algorithm that uses outputs from first model to define which CITs to present to users. To the best of our efforts, no other system was found to use ML approaches to address the problem of CIT selection."
JOUR,"Lotfy, Nourmeen, Shehab, Abdulaziz, Elhoseny, Mohammed, Abu-Elfetouh, Ahmed",An Enhanced Automatic Arabic Essay Scoring System Based on Machine Learning Algorithms,,,2023,"Despite the extensive effort to improve intelligent educational tools for smart learning environments, automatic Arabic essay scoring remains a big research challenge. The nature of the writing style of the Arabic language makes the problem even more complicated. This study designs, implements, and evaluates an automatic Arabic essay scoring system. The proposed system starts with pre-processing the student answer and model answer dataset using data cleaning and natural language processing tasks. Then, it comprises two main components: the grading engine and the adaptive fusion engine. The grading engine employs string-based and corpus-based similarity algorithms separately. After that, the adaptive fusion engine aims to prepare students’ scores to be delivered to different feature selection algorithms, such as Recursive Feature Elimination and Boruta. Then, some machine learning algorithms such as Decision Tree, Random Forest, Adaboost, Lasso, Bagging, and K-Nearest Neighbor are employed to improve the suggested system’s efficiency. The experimental results in the grading engine showed that Extracting DIStributionally similar words using the CO-occurrences similarity measure achieved the best correlation values. Furthermore, in the adaptive fusion engine, the Random Forest algorithm outperforms all other machine learning algorithms using the (80%–20%) splitting method on the original dataset. It achieves 91.30%, 94.20%, 0.023, 0.106, and 0.153 in terms of Pearson’s Correlation Coefficient, Willmot’s Index of Agreement, Mean Square Error, Mean Absolute Error, and Root Mean Square Error metrics, respectively."
JOUR,"Andersen, Michael Riis, Kabel, Kristine, Bremholm, Jesper, Bundsgaard, Jeppe, Hansen, Lars Kai",Automatic proficiency scoring for early-stage writing,,,2023,"In this work, we study the feasibility of using machine learning and natural language processing methods for assessing writing proficiency in Danish with respect to text construction, sentence construction, and use of modifiers. Our work is based on the analytical framework for scoring early writing proposed by Kabel et al. (2022), where each text is first annotated by a human expert according to a predefined coding scheme and subsequently scored using statistical Rasch modeling (Rasch, 1960). We investigate two different strategies for estimating these scores automatically: 1) we propose a system for identifying the central linguistic features automatically mimicking the role of the human experts and 2) we train state-of-the-art discriminative machine learning models to predict the proficiency scores directly from the texts. We conduct a number of experiments to evaluate and compare the two approaches. Our results show strong and statistically significant correlations between the scores generated using the automatic system and scores based on human experts. We also estimate and report the reliability of the individual linguistic features in the automatic annotation system. Finally, we also propose and evaluate an extension of the statistical model, which allows the model to compensate for potential systematic errors in the automatic annotations. The article thereby contributes to the area of automated essay scoring (AES) and shows that it is possible to provide teachers with automated valid and reliable knowledge about the development of their students' writing competences, which they can use in their feedback to students."
CONF,"P. Pathak, S. Raghav, S. Jain, S. Jalal",,Essay Rating System Using Machine Learning,22-23 Oct. 2021,2021,"Essay Rating is the process of assigning grades to the essays written for professional purposes. Automating this process implies the use of specified machine learning algorithms over the standard manual methods to evaluate the essays through Natural Language Processing. Essays can be termed as a large set of textual entities. Grading these essays involves distributing them into a fewer number of distinct categories based on certain constraints and standards. These categories are then used to assign the possible grades. Because of numerous factors like cost, time, biasness, and delay in results, there is a need to switch from manually checking the essays to automated grading. It is a very tedious task to evaluate a bulk of essays while probing every kind of error. Henceforth, this model of Automated Essay Grading System models seems quite assuring. It takes text input from the user and generates grades conforming to the pre-defined standards. After evaluating its useful attributes, an output is obtained in the form of a grade for the given essay. This project comprises of grammar-based Checking (Checking Unique Word count, Sentence Count, Grammatical Mistakes, Spelling Errors) and Context Based Checking (Application of NLP to categorize the essays)."
CONF,"A. M. Bojamma, M. Bhattacharya, T. C. F. Liu",,A Lexical Model for Automated Essay Evaluation System Using Ensemble Learning Techniques,3-5 Oct. 2024,2024,"Automated Essay Scoring (AES) systems have become an attractive alternative to manual scoring due to their cost-saving benefits. This paper assesses the feasibility of such systems by conducting a study using a custom-built machine learning model, which employs the Random Forest Classifier to predict essay grades. Among the features used to train the model, individual and unique word counts emerged as the most effective in influencing the ratings. However, excessive reliance on these features has often been criticized and labeled as reductive. Regarding practical applications, the AES system developed in this study may be better suited for making estimations rather than serving as a substitute for human reviewers. In the future, improvements could focus on enabling the model to analyze higher-level features, such as flow and style."
CONF,"R. Bhatt, M. Patel, G. Srivastava, V. Mago",,A Graph Based Approach to Automate Essay Evaluation,11-14 Oct. 2020,2020,"Despite studies of over six decades, research on automated essay scoring continues to grab ample attention in the Natural Language Processing (NLP) community in part because of its commercial and educational value. However, evaluating such writing compositions or essays in terms of reliability and time is a very challenging process. The need for reliable and rapid scores has elevated the need for a computer system that can answer essay questions that fit precise prompts automatically. NLP and machine learning strategies use Automated Essay Scoring (AES) systems to solve the difficulty of scoring writing tasks. In this paper, we suggest an AES approach that involves not only rule-based grammar and consistency tests, but also the semantic similarity of sentences, thus giving priority to question prompts. Similarity vectors are used obtained after applying semantic algorithms and calculated statistical features. Our system uses 22 features with high predicting power, which is less than current systems, while considering every aspect a human grader may focus on.Predicting scores is achieved using the data provided by Kaggle's ASAP competition using Random Forest. The resulting agreement between the score of the human grader and the prediction of the system is compared with promising results through experimental evaluation."
CONF,"B. S. J. Kapoor, S. M. Nagpure, S. S. Kolhatkar, P. G. Chanore, M. M. Vishwakarma, R. B. Kokate",,An Analysis of Automated Answer Evaluation Systems based on Machine Learning,26-28 Feb. 2020,2020,"Evaluation of the answers remain as one of the most important factors in the learning and teaching process. Automatic evaluation of the answers is very necessary thus, many system has been developed in this digital era. Usually, the subjective answers are in either short form or long answers. The existing system available for evaluation has shown mediocre result in evaluating and scoring the answers. In such frameworks, the data recovery technique to gauge likeness between understudies answer and references answer is utilized, yet such scoring framework doesn't give the best outcome yet. There are very few keywords available in short answers. The answers with such limited number of keywords needs special care, especially while calculating the weighting score of the answers. In the presented study, we try to summarize the existing mechanism and analyses the performance of the system used for automatic grading of the long and descriptive answers."
CONF,"N. G. Pasaribu, G. Budiman, I. D. Irawati",,NasNet Model for Image-Based Essay Scoring Deep Learning,20-21 Aug. 2024,2024,"Automated essay grading systems have increasingly become a focal point in the educational landscape, primarily due to their potential to enhance the efficiency and objectivity of essay evaluation processes. Recognizing this potential, the paper presents an innovative strategy for automated essay grading that leverages the NasNetMobile architecture as its foundational model. The methodology outlined involves a meticulous data division according to specific question numbers, followed by a manual aggregation of scores assigned to each question to derive a final grade for every essay. Through rigorous exper-imentation, the paper identifies an optimal data partitioning strategy, revealing that a 60% split for testing coupled with a 40% allocation for training purposes culminates in a remarkable accuracy rate of 84%. The technical implementation of this system is executed using the Python programming language, TensorFlow Keras for machine learning model development, and Google Colab for project collaboration and resource sharing. The choice of the Adam optimizer, characterized by a learning rate of 0.002 and a batch size of 32, significantly contributed to the system's adeptness in precisely classifying students' essay scores. Demonstrated through these findings, our proposed automated essay grading system showcases its substantial capability to serve as an effective and reliable tool in assessing student essays, thereby holding considerable promise for future adoption and further development within educational settings."
CONF,"H. C. R. Jeewantha, A. N. Gajasinghe, N. I. Naidabadu, T. N. Rajapaksha, D. Kasthurirathna, A. Karunasena",,"English Language Trainer for Non-Native Speakers using Audio Signal Processing, Reinforcement Learning, and Deep Learning",2-3 Dec. 2021,2021,"Lack of basic proficiency and confidence in writing and speaking in English is one of the major social problems faced by most non-native English speakers. Although the general adult literacy rate in Sri Lanka is above average by world standards, the English literacy rate is just 22% among the Sri Lankan adult population. Many individuals face setbacks in achieving their career and academic goals due to these language barriers. In a world where English has become a compulsory requirement to pursue higher education, career development, and performing day-to-day activities, ""English Buddy"" is a software solution developed to enhance the English learning experience of individuals in a more personalized and innovative way. The system provides an all-in-one solution while filling major research and market gaps in existing solutions in the e-learning domain. The system consists of a personalized learning environment, automated pronunciation error detection system, automated essay evaluation process, automated descriptive answer evaluation component based on semantic similarity, and real-time course content rating system. English Buddy is implemented using state-of-the-art technologies such as Audio Signal Processing, Reinforcement Learning, Deep Learning, and NLP. The LSTM, Sentiment Analysis, and Siamese network models have gained accuracy scores of 0.93, 0.92, and 0.81 respectively. Further, the UAT results proved that the personalized recommendations and pronunciation error detection processes are accurate and reliable. This research has been able to overcome the limitations of most existing solutions that follow traditional approaches and provide better results compared to the recent studies in the e-learning research domain."
